{
  "schema_version": "1.0.0",
  "league_id": "fl",
  "name": "The Fictional League",
  "clubs": [
    {
      "team_id": "ash",
      "name": "Ashmere Athletic",
      "short_name": "Ashmere",
      "city": "Ashmere",
      "stadium": "Kilnside Park",
      "colours": {
        "primary": "#B3202A",
        "secondary": "#F2E8D5",
        "text": "#FFFFFF"
      },
      "rating": 74,
      "formation": "4-3-3",
      "rival_ids": [
        "brk"
      ],
      "squad": [
        {
          "player_id": "ash-01",
          "name": "Bram Ostrand",
          "short_name": "Ostrand",
          "shirt": 1,
          "position": "GK",
          "role": "GK",
          "foot": "left",
          "top_speed_kmh": 34.1,
          "attributes": {
            "pace": 82,
            "acceleration": 65,
            "passing": 70,
            "vision": 64,
            "finishing": 65,
            "tackling": 67,
            "keeping": 63,
            "discipline": 81,
            "stamina": 63
          }
        },
        {
          "player_id": "ash-02",
          "name": "Jonah Mayhew-Stroud",
          "short_name": "Mayhew-Stroud",
          "shirt": 2,
          "position": "DF",
          "role": "RB",
          "foot": "right",
          "top_speed_kmh": 33.2,
          "attributes": {
            "pace": 66,
            "acceleration": 84,
            "passing": 82,
            "vision": 84,
            "finishing": 68,
            "tackling": 72,
            "keeping": 20,
            "discipline": 63,
            "stamina": 81
          }
        },
        {
          "player_id": "ash-04",
          "name": "Dario Prothero-Lake",
          "short_name": "Prothero-Lake",
          "shirt": 4,
          "position": "DF",
          "role": "CB",
          "foot": "left",
          "top_speed_kmh": 33.7,
          "attributes": {
            "pace": 76,
            "acceleration": 76,
            "passing": 63,
            "vision": 70,
            "finishing": 79,
            "tackling": 75,
            "keeping": 19,
            "discipline": 78,
            "stamina": 77
          }
        },
        {
          "player_id": "ash-05",
          "name": "Tomas Garrowby",
          "short_name": "Garrowby",
          "shirt": 5,
          "position": "DF",
          "role": "CB",
          "foot": "left",
          "top_speed_kmh": 32.9,
          "attributes": {
            "pace": 62,
            "acceleration": 82,
            "passing": 77,
            "vision": 65,
            "finishing": 80,
            "tackling": 83,
            "keeping": 18,
            "discipline": 83,
            "stamina": 75
          }
        },
        {
          "player_id": "ash-03",
          "name": "Rafe Halloway",
          "short_name": "Halloway",
          "shirt": 3,
          "position": "DF",
          "role": "LB",
          "foot": "right",
          "top_speed_kmh": 33.2,
          "attributes": {
            "pace": 67,
            "acceleration": 62,
            "passing": 82,
            "vision": 83,
            "finishing": 62,
            "tackling": 77,
            "keeping": 14,
            "discipline": 38,
            "stamina": 82
          }
        },
        {
          "player_id": "ash-06",
          "name": "Osei Brennick",
          "short_name": "Brennick",
          "shirt": 6,
          "position": "MF",
          "role": "DM",
          "foot": "left",
          "top_speed_kmh": 33.4,
          "attributes": {
            "pace": 70,
            "acceleration": 65,
            "passing": 69,
            "vision": 63,
            "finishing": 65,
            "tackling": 77,
            "keeping": 16,
            "discipline": 82,
            "stamina": 70
          }
        },
        {
          "player_id": "ash-08",
          "name": "Teo Kestley",
          "short_name": "Kestley",
          "shirt": 8,
          "position": "MF",
          "role": "CM",
          "foot": "right",
          "top_speed_kmh": 33.0,
          "attributes": {
            "pace": 63,
            "acceleration": 73,
            "passing": 88,
            "vision": 90,
            "finishing": 66,
            "tackling": 71,
            "keeping": 20,
            "discipline": 84,
            "stamina": 67
          }
        },
        {
          "player_id": "ash-10",
          "name": "Kofi Quenby",
          "short_name": "Quenby",
          "shirt": 10,
          "position": "MF",
          "role": "CM",
          "foot": "right",
          "top_speed_kmh": 32.9,
          "attributes": {
            "pace": 62,
            "acceleration": 75,
            "passing": 65,
            "vision": 80,
            "finishing": 70,
            "tackling": 72,
            "keeping": 14,
            "discipline": 79,
            "stamina": 80
          }
        },
        {
          "player_id": "ash-07",
          "name": "Teo Underhay",
          "short_name": "Underhay",
          "shirt": 7,
          "position": "FW",
          "role": "RW",
          "foot": "left",
          "top_speed_kmh": 34.1,
          "attributes": {
            "pace": 82,
            "acceleration": 84,
            "passing": 77,
            "vision": 72,
            "finishing": 68,
            "tackling": 70,
            "keeping": 13,
            "discipline": 71,
            "stamina": 64
          }
        },
        {
          "player_id": "ash-09",
          "name": "Idris Varrow",
          "short_name": "Varrow",
          "shirt": 9,
          "position": "FW",
          "role": "ST",
          "foot": "right",
          "top_speed_kmh": 34.6,
          "attributes": {
            "pace": 91,
            "acceleration": 89,
            "passing": 77,
            "vision": 65,
            "finishing": 84,
            "tackling": 78,
            "keeping": 21,
            "discipline": 66,
            "stamina": 65
          }
        },
        {
          "player_id": "ash-11",
          "name": "Silas Sorrel",
          "short_name": "Sorrel",
          "shirt": 11,
          "position": "FW",
          "role": "LW",
          "foot": "right",
          "top_speed_kmh": 33.5,
          "attributes": {
            "pace": 72,
            "acceleration": 67,
            "passing": 70,
            "vision": 73,
            "finishing": 64,
            "tackling": 76,
            "keeping": 15,
            "discipline": 80,
            "stamina": 75
          }
        },
        {
          "player_id": "ash-12",
          "name": "Yannick Tamsett",
          "short_name": "Tamsett",
          "shirt": 12,
          "position": "DF",
          "role": "CB",
          "foot": "left",
          "top_speed_kmh": 33.7,
          "attributes": {
            "pace": 75,
            "acceleration": 68,
            "passing": 84,
            "vision": 80,
            "finishing": 69,
            "tackling": 67,
            "keeping": 17,
            "discipline": 78,
            "stamina": 80
          }
        },
        {
          "player_id": "ash-13",
          "name": "Felix Ballantrae-Cole",
          "short_name": "Ballantrae-Cole",
          "shirt": 13,
          "position": "GK",
          "role": "GK",
          "foot": "left",
          "top_speed_kmh": 33.6,
          "attributes": {
            "pace": 73,
            "acceleration": 77,
            "passing": 69,
            "vision": 77,
            "finishing": 72,
            "tackling": 66,
            "keeping": 77,
            "discipline": 80,
            "stamina": 69
          }
        },
        {
          "player_id": "ash-14",
          "name": "Oren Marchetti-Rowe",
          "short_name": "Marchetti-Rowe",
          "shirt": 14,
          "position": "MF",
          "role": "CM",
          "foot": "right",
          "top_speed_kmh": 33.4,
          "attributes": {
            "pace": 71,
            "acceleration": 71,
            "passing": 62,
            "vision": 73,
            "finishing": 82,
            "tackling": 68,
            "keeping": 20,
            "discipline": 83,
            "stamina": 80
          }
        },
        {
          "player_id": "ash-15",
          "name": "Jonah Fenwright",
          "short_name": "Fenwright",
          "shirt": 15,
          "position": "DF",
          "role": "FB",
          "foot": "right",
          "top_speed_kmh": 33.7,
          "attributes": {
            "pace": 75,
            "acceleration": 63,
            "passing": 81,
            "vision": 70,
            "finishing": 69,
            "tackling": 67,
            "keeping": 18,
            "discipline": 68,
            "stamina": 64
          }
        },
        {
          "player_id": "ash-16",
          "name": "Soren Vassago",
          "short_name": "Vassago",
          "shirt": 16,
          "position": "MF",
          "role": "AM",
          "foot": "both",
          "top_speed_kmh": 33.8,
          "attributes": {
            "pace": 77,
            "acceleration": 73,
            "passing": 83,
            "vision": 69,
            "finishing": 70,
            "tackling": 67,
            "keeping": 14,
            "discipline": 84,
            "stamina": 80
          }
        },
        {
          "player_id": "ash-17",
          "name": "Soren Nkemdi-Vale",
          "short_name": "Nkemdi-Vale",
          "shirt": 17,
          "position": "FW",
          "role": "W",
          "foot": "right",
          "top_speed_kmh": 33.1,
          "attributes": {
            "pace": 65,
            "acceleration": 67,
            "passing": 84,
            "vision": 81,
            "finishing": 65,
            "tackling": 64,
            "keeping": 12,
            "discipline": 66,
            "stamina": 73
          }
        },
        {
          "player_id": "ash-18",
          "name": "Osei Whitlam-Rees",
          "short_name": "Whitlam-Rees",
          "shirt": 18,
          "position": "FW",
          "role": "ST",